{
  "schema_version": "1.0.0",
  "handoff_id": "HO001",
  "revision": 1,
  "status": "READY",
  "supersedes": null,
  "research_project_id": "project/harmony-study",
  "research_project_version": "1.1.0",
  "research_commit": "0123456789abcdef0123456789abcdef01234567",
  "generated_at": "2026-08-11T21:00:00+09:00",
  "selection": {
    "status": "AGENT_RECOMMENDED",
    "selected_hypothesis_id": "PH001",
    "alternative_hypothesis_ids": ["PH002"],
    "authority": "agent-recommended",
    "human_approval_required": false
  },
  "creative_direction_ref": "05_production/creative-direction.md",
  "requirements": [
    {
      "id": "RQ001",
      "statement": "Make the repeated interval and one interruption observable.",
      "priority": "mandatory",
      "source_decision_ids": ["DC001"],
      "acceptance_test_ids": ["AT001"]
    }
  ],
  "prototype_plan_ids": ["PP001"],
  "constraints": {
    "rights": [],
    "safety": ["Review safety after any material change."],
    "privacy": [],
    "prohibited_actions": ["Do not purchase, contract, or publish without human approval."]
  },
  "open_gaps": [
    {
      "id": "GP001",
      "statement": "Final venue dimensions are unknown.",
      "impact": "Final size and delivery route cannot be fixed.",
      "resolution_owner": "production"
    }
  ],
  "replan_triggers": ["Venue change", "Material specification change", "Mandatory acceptance test failure"],
  "source_refs": {
    "decision_ids": ["DC001"],
    "insight_ids": ["IN001"],
    "evidence_ids": ["EV001", "EV002"]
  },
  "integrity": {
    "content_sha256": "sha256:aaaaaaaaaaaaaaaaaaaaaaaaaaaaaaaaaaaaaaaaaaaaaaaaaaaaaaaaaaaaaaaa"
  }
}
